{
  "$schema": "../../../packages/sdk/schemas/manifest.schema.json",
  "id": "press.swarm.examples.ligurian-ferries",
  "name": "Ligurian ferries",
  "version": "0.1.0",
  "sdk": "^0.1.0",
  "description": "A context provider: reads the Golfo dei Poeti ferry timetable page and turns cancellations into a transport fact and a happening for the newsroom.",
  "kinds": ["context-provider"],
  "capabilities": ["web"],
  "origins": ["https://www.navigazionegolfodeipoeti.it"],
  "entry": { "bundle": "src/index.ts" },
  "poll": { "cadenceMinutes": 30, "regions": ["cinque-terre"] },
  "provenance": { "author": { "name": "swarm.press examples" } }
}
