{
  "$schema": "../../../packages/sdk/schemas/manifest.schema.json",
  "id": "press.swarm.examples.fact-checker",
  "name": "Fact-check desk",
  "version": "0.1.0",
  "sdk": "^0.1.0",
  "description": "An agent skill: a claim-extraction tool and a fact-check job that checks claims against Wikipedia summaries with a low-tier model.",
  "kinds": ["skill"],
  "capabilities": ["web", "llm:low", "store:factchecks"],
  "origins": ["https://en.wikipedia.org"],
  "entry": { "bundle": "src/index.ts" },
  "provenance": { "author": { "name": "swarm.press examples" } }
}
